{
  "schema": "stela.model/1",
  "producer": {
    "stela": "0.1.0",
    "libclang": "clang version 22.1.3 (https://github.com/llvm/llvm-project e9846648fd6183ee6d8cbdb4502213fcf902a211)"
  },
  "targets": ["x86_64-pc-windows-msvc", "i686-pc-windows-msvc", "aarch64-pc-windows-msvc"],
  "libraries": [
    {
      "name": "jsi_abi",
      "prefix": "jsi",
      "macroPrefix": "JSI_ABI",
      "status": "jsi_status",
      "headers": ["src/jsi_abi/jsi_abi.h"],
      "includeDirs": ["src"],
      "defines": [],
      "stelaHeader": "src/jsi_abi/jsi_abi_stela.h",
      "declarations": [
        {
          "kind": "macro",
          "name": "JSI_ABI_H_",
          "location": {"file": "src/jsi_abi/jsi_abi.h", "line": 30, "column": 9},
          "doc": null,
          "annotations": [],
          "functionLike": false,
          "replacement": []
        },
        {
          "kind": "macro",
          "name": "JSI_ABI_CDECL",
          "location": {"file": "src/jsi_abi/jsi_abi.h", "line": 51, "column": 9},
          "doc": null,
          "annotations": [],
          "functionLike": false,
          "replacement": ["__cdecl"]
        },
        {
          "kind": "macro",
          "name": "JSI_ABI_API",
          "location": {"file": "src/jsi_abi/jsi_abi.h", "line": 69, "column": 9},
          "doc": null,
          "annotations": [],
          "functionLike": false,
          "replacement": []
        },
        {
          "kind": "macro",
          "name": "JSI_ABI_VERSION",
          "location": {"file": "src/jsi_abi/jsi_abi.h", "line": 85, "column": 9},
          "doc": null,
          "annotations": [],
          "functionLike": false,
          "replacement": ["2u"],
          "perTarget": {
            "x86_64-pc-windows-msvc": {"value": "2"},
            "i686-pc-windows-msvc": {"value": "2"},
            "aarch64-pc-windows-msvc": {"value": "2"}
          }
        },
        {
          "kind": "struct",
          "name": "jsi_runtime",
          "location": {"file": "src/jsi_abi/jsi_abi.h", "line": 91, "column": 16},
          "doc": "A JSI runtime instance.",
          "annotations": [],
          "fields": [
            {
              "name": "api",
              "type": {"pointer": {"name": "jsi_runtime_api", "const": true}},
              "annotations": [],
              "doc": null
            }
          ],
          "perTarget": {
            "x86_64-pc-windows-msvc": {"size": 8, "align": 8, "offsets": [0]},
            "i686-pc-windows-msvc": {"size": 4, "align": 4, "offsets": [0]},
            "aarch64-pc-windows-msvc": {"size": 8, "align": 8, "offsets": [0]}
          }
        },
        {
          "kind": "typedef",
          "name": "jsi_runtime",
          "location": {"file": "src/jsi_abi/jsi_abi.h", "line": 91, "column": 28},
          "doc": null,
          "annotations": [],
          "type": {"name": "jsi_runtime"},
          "perTarget": {
            "x86_64-pc-windows-msvc": {
              "canonicalType": {"name": "jsi_runtime"},
              "size": 8,
              "align": 8
            },
            "i686-pc-windows-msvc": {
              "canonicalType": {"name": "jsi_runtime"},
              "size": 4,
              "align": 4
            },
            "aarch64-pc-windows-msvc": {
              "canonicalType": {"name": "jsi_runtime"},
              "size": 8,
              "align": 8
            }
          }
        },
        {
          "kind": "struct",
          "name": "jsi_runtime_api",
          "location": {"file": "src/jsi_abi/jsi_abi.h", "line": 92, "column": 16},
          "doc": "The runtime function table.",
          "annotations": [],
          "fields": [
            {
              "name": "query_interface",
              "type": {
                "pointer": {
                  "function": {
                    "result": {"name": "jsi_status"},
                    "params": [
                      {
                        "name": "rt",
                        "type": {"pointer": {"name": "jsi_runtime"}},
                        "annotations": []
                      },
                      {
                        "name": "iid",
                        "type": {"pointer": {"name": "jsi_interface_id", "const": true}},
                        "annotations": []
                      },
                      {
                        "name": "out_api",
                        "type": {"pointer": {"pointer": {"builtin": "void", "const": true}}},
                        "annotations": []
                      },
                      {
                        "name": "out_instance",
                        "type": {"pointer": {"pointer": {"builtin": "void"}}},
                        "annotations": []
                      }
                    ],
                    "variadic": false
                  }
                }
              },
              "annotations": [],
              "doc": "Query for an optional interface extension.\nReturns jsi_status_native_error with empty message if not supported."
            },
            {
              "name": "get_abi_version",
              "type": {
                "pointer": {
                  "function": {
                    "result": {"name": "uint32_t"},
                    "params": [
                      {
                        "name": "rt",
                        "type": {"pointer": {"name": "jsi_runtime"}},
                        "annotations": []
                      }
                    ],
                    "variadic": false
                  }
                }
              },
              "annotations": [],
              "doc": "Report the implementation's max supported ABI version (Node-API\nnapi_get_version analog). Optional feature-probe — the create-time version\nnegotiation in v8_jsi_abi_runtime_create is what actually gates."
            },
            {
              "name": "add_ref",
              "type": {
                "pointer": {
                  "function": {
                    "result": {"builtin": "void"},
                    "params": [
                      {
                        "name": "arg0",
                        "type": {"pointer": {"name": "jsi_runtime"}},
                        "annotations": []
                      }
                    ],
                    "variadic": false
                  }
                }
              },
              "annotations": [],
              "doc": null
            },
            {
              "name": "release",
              "type": {
                "pointer": {
                  "function": {
                    "result": {"builtin": "void"},
                    "params": [
                      {
                        "name": "arg0",
                        "type": {"pointer": {"name": "jsi_runtime"}},
                        "annotations": []
                      }
                    ],
                    "variadic": false
                  }
                }
              },
              "annotations": [],
              "doc": null
            },
            {
              "name": "get_and_clear_js_error_value",
              "type": {
                "pointer": {
                  "function": {
                    "result": {"name": "jsi_value"},
                    "params": [
                      {
                        "name": "rt",
                        "type": {"pointer": {"name": "jsi_runtime"}},
                        "annotations": []
                      }
                    ],
                    "variadic": false
                  }
                }
              },
              "annotations": [],
              "doc": "Get and clear the JS exception value (after jsi_status_js_error)."
            },
            {
              "name": "get_and_clear_native_exception_message",
              "type": {
                "pointer": {
                  "function": {
                    "result": {"builtin": "void"},
                    "params": [
                      {
                        "name": "rt",
                        "type": {"pointer": {"name": "jsi_runtime"}},
                        "annotations": []
                      },
                      {
                        "name": "buffer",
                        "type": {"pointer": {"name": "jsi_growable_buffer"}},
                        "annotations": []
                      }
                    ],
                    "variadic": false
                  }
                }
              },
              "annotations": [],
              "doc": "Get and clear native exception message (after jsi_status_native_error)."
            },
            {
              "name": "set_js_error_value",
              "type": {
                "pointer": {
                  "function": {
                    "result": {"builtin": "void"},
                    "params": [
                      {
                        "name": "rt",
                        "type": {"pointer": {"name": "jsi_runtime"}},
                        "annotations": []
                      },
                      {
                        "name": "error_value",
                        "type": {"pointer": {"name": "jsi_value", "const": true}},
                        "annotations": []
                      }
                    ],
                    "variadic": false
                  }
                }
              },
              "annotations": [],
              "doc": null
            },
            {
              "name": "set_native_exception_message_utf8",
              "type": {
                "pointer": {
                  "function": {
                    "result": {"builtin": "void"},
                    "params": [
                      {
                        "name": "rt",
                        "type": {"pointer": {"name": "jsi_runtime"}},
                        "annotations": []
                      },